{
  "manifestVersion": "1.0.0",
  "title": "Staging/Prod structural parity manifest (DEP-05)",
  "description": "Repository-only parity rule for DEP-05: staging and prod declare the same service set, the same env var NAMES (secret names only, never values), the same artifact inputs and the same runtimes. Scale-only differences (replica counts, instance sizes) are allowed. parityStatus is PENDING and parityAchieved is false: this is a repository contract assertion, not a claim that anything is deployed.",
  "status": "PROPOSED",
  "approvalStatus": "PENDING",
  "sourceManifest": "infra/deployment-contracts/manifest.json",
  "rule": "structural parity: identical service set, env var name sets, artifact inputs and runtimes in staging and prod; scale-only differences allowed.",
  "secretNamesOnly": true,
  "scaleDifferencesAllowed": true,
  "parityStatus": "PENDING",
  "parityAchieved": false,
  "services": [
    {
      "serviceId": "web-api",
      "staging": {
        "replicasProposed": 1,
        "instanceSizeProposed": "small",
        "envVarNames": [
          "SUPABASE_URL",
          "SUPABASE_SERVICE_ROLE_KEY",
          "SUPABASE_SCHEMA",
          "CLAUDE_MODEL",
          "CLAUDE_SCORING_MODEL",
          "COMPANY_NAME",
          "CLAUDE_BIN",
          "CLAUDE_TIMEOUT_MS",
          "PORT",
          "WEB_ORIGIN",
          "LIVEKIT_URL",
          "LIVEKIT_API_KEY",
          "LIVEKIT_API_SECRET",
          "BROWSER_LIVEKIT_TARGET",
          "R1_LIVEKIT_URL",
          "R1_LIVEKIT_API_KEY",
          "R1_LIVEKIT_API_SECRET",
          "RECORDINGS_BUCKET",
          "RECORDING_DOWNLOAD_TTL_SEC",
          "RECORDING_MAX_BYTES",
          "NODE_ENV",
          "SHUTDOWN_GRACE_MS",
          "BREAKER_FAILURE_THRESHOLD",
          "BREAKER_COOLDOWN_MS",
          "BREAKER_TIMEOUT_MS",
          "CLAUDE_MAX_OUTPUT_BYTES",
          "RATE_LIMIT_DEFAULT",
          "RATE_LIMIT_STRICT",
          "RATE_LIMIT_IP",
          "RATE_LIMIT_WINDOW_SEC",
          "TRUSTED_PROXY",
          "WORKER_CONTEXT_SECRET",
          "RESUME_SCANNER",
          "RESUME_MAX_COMPRESSED_BYTES",
          "RESUME_PARSER_TIMEOUT_MS",
          "RESUME_MAX_TEXT_LENGTH",
          "VITE_API_BASE",
          "VITE_SUPABASE_URL",
          "VITE_SUPABASE_ANON_KEY",
          "VITE_LIVEKIT_URL",
          "VITE_SSO_PROVIDERS",
          "VITE_CSP_MODE",
          "VITE_CSP_REPORT_ENDPOINT"
        ]
      },
      "prod": {
        "replicasProposed": 2,
        "instanceSizeProposed": "medium",
        "envVarNames": [
          "SUPABASE_URL",
          "SUPABASE_SERVICE_ROLE_KEY",
          "SUPABASE_SCHEMA",
          "CLAUDE_MODEL",
          "CLAUDE_SCORING_MODEL",
          "COMPANY_NAME",
          "CLAUDE_BIN",
          "CLAUDE_TIMEOUT_MS",
          "PORT",
          "WEB_ORIGIN",
          "LIVEKIT_URL",
          "LIVEKIT_API_KEY",
          "LIVEKIT_API_SECRET",
          "BROWSER_LIVEKIT_TARGET",
          "R1_LIVEKIT_URL",
          "R1_LIVEKIT_API_KEY",
          "R1_LIVEKIT_API_SECRET",
          "RECORDINGS_BUCKET",
          "RECORDING_DOWNLOAD_TTL_SEC",
          "RECORDING_MAX_BYTES",
          "NODE_ENV",
          "SHUTDOWN_GRACE_MS",
          "BREAKER_FAILURE_THRESHOLD",
          "BREAKER_COOLDOWN_MS",
          "BREAKER_TIMEOUT_MS",
          "CLAUDE_MAX_OUTPUT_BYTES",
          "RATE_LIMIT_DEFAULT",
          "RATE_LIMIT_STRICT",
          "RATE_LIMIT_IP",
          "RATE_LIMIT_WINDOW_SEC",
          "TRUSTED_PROXY",
          "WORKER_CONTEXT_SECRET",
          "RESUME_SCANNER",
          "RESUME_MAX_COMPRESSED_BYTES",
          "RESUME_PARSER_TIMEOUT_MS",
          "RESUME_MAX_TEXT_LENGTH",
          "VITE_API_BASE",
          "VITE_SUPABASE_URL",
          "VITE_SUPABASE_ANON_KEY",
          "VITE_LIVEKIT_URL",
          "VITE_SSO_PROVIDERS",
          "VITE_CSP_MODE",
          "VITE_CSP_REPORT_ENDPOINT"
        ]
      },
      "structuralEquivalence": {
        "sameService": true,
        "sameEnvVarNames": true,
        "sameSecretNames": true,
        "sameArtifactInput": true,
        "sameRuntime": true,
        "status": "PENDING"
      }
    },
    {
      "serviceId": "livekit-cloud",
      "staging": {
        "replicasProposed": 1,
        "instanceSizeProposed": "provider-managed",
        "envVarNames": []
      },
      "prod": {
        "replicasProposed": 1,
        "instanceSizeProposed": "provider-managed",
        "envVarNames": []
      },
      "structuralEquivalence": {
        "sameService": true,
        "sameEnvVarNames": true,
        "sameSecretNames": true,
        "sameArtifactInput": true,
        "sameRuntime": true,
        "status": "PENDING"
      }
    },
    {
      "serviceId": "livekit-agents",
      "staging": {
        "replicasProposed": 1,
        "instanceSizeProposed": "managed-default",
        "envVarNames": [
          "ANTHROPIC_API_KEY",
          "SARVAM_API_KEY",
          "COMPANY_NAME",
          "ANTHROPIC_MODEL",
          "SARVAM_STT_MODEL",
          "SARVAM_LANGUAGE",
          "SARVAM_TTS_MODEL",
          "SARVAM_TTS_VOICE",
          "LIVEKIT_VAD_ACTIVATION_THRESHOLD",
          "LIVEKIT_VAD_MIN_SPEECH_DURATION",
          "LIVEKIT_VAD_MIN_SILENCE_DURATION",
          "LIVEKIT_VAD_PREFIX_PADDING_DURATION",
          "LIVEKIT_MIN_ENDPOINTING_DELAY",
          "LIVEKIT_MAX_ENDPOINTING_DELAY",
          "LIVEKIT_MIN_INTERRUPTION_DURATION",
          "LIVEKIT_MIN_INTERRUPTION_WORDS",
          "LIVEKIT_FALSE_INTERRUPTION_TIMEOUT",
          "LIVEKIT_WORKER_DRAIN_SEC",
          "GOPU_CANDIDATE_NAME",
          "GOPU_ROLE_TITLE",
          "GOPU_ROLE_FOCUS",
          "GOPU_RESUME_FACTS",
          "GOPU_CONTEXT_JSON",
          "LIVEKIT_URL",
          "LIVEKIT_API_KEY",
          "LIVEKIT_API_SECRET",
          "SUPABASE_URL",
          "SUPABASE_SERVICE_ROLE_KEY",
          "SUPABASE_SCHEMA",
          "API_BASE",
          "WORKER_CONTEXT_SECRET",
          "WORKER_CONTEXT_TIMEOUT_SEC",
          "SCORING_BREAKER_THRESHOLD",
          "SCORING_BREAKER_COOLDOWN_SEC",
          "SCORING_BREAKER_TIMEOUT_SEC",
          "SCORING_HTTP_CONNECT_TIMEOUT",
          "SCORING_HTTP_READ_TIMEOUT",
          "SCORING_HTTP_WRITE_TIMEOUT",
          "SCORING_HTTP_POOL_TIMEOUT"
        ]
      },
      "prod": {
        "replicasProposed": 2,
        "instanceSizeProposed": "managed-default",
        "envVarNames": [
          "ANTHROPIC_API_KEY",
          "SARVAM_API_KEY",
          "COMPANY_NAME",
          "ANTHROPIC_MODEL",
          "SARVAM_STT_MODEL",
          "SARVAM_LANGUAGE",
          "SARVAM_TTS_MODEL",
          "SARVAM_TTS_VOICE",
          "LIVEKIT_VAD_ACTIVATION_THRESHOLD",
          "LIVEKIT_VAD_MIN_SPEECH_DURATION",
          "LIVEKIT_VAD_MIN_SILENCE_DURATION",
          "LIVEKIT_VAD_PREFIX_PADDING_DURATION",
          "LIVEKIT_MIN_ENDPOINTING_DELAY",
          "LIVEKIT_MAX_ENDPOINTING_DELAY",
          "LIVEKIT_MIN_INTERRUPTION_DURATION",
          "LIVEKIT_MIN_INTERRUPTION_WORDS",
          "LIVEKIT_FALSE_INTERRUPTION_TIMEOUT",
          "LIVEKIT_WORKER_DRAIN_SEC",
          "GOPU_CANDIDATE_NAME",
          "GOPU_ROLE_TITLE",
          "GOPU_ROLE_FOCUS",
          "GOPU_RESUME_FACTS",
          "GOPU_CONTEXT_JSON",
          "LIVEKIT_URL",
          "LIVEKIT_API_KEY",
          "LIVEKIT_API_SECRET",
          "SUPABASE_URL",
          "SUPABASE_SERVICE_ROLE_KEY",
          "SUPABASE_SCHEMA",
          "API_BASE",
          "WORKER_CONTEXT_SECRET",
          "WORKER_CONTEXT_TIMEOUT_SEC",
          "SCORING_BREAKER_THRESHOLD",
          "SCORING_BREAKER_COOLDOWN_SEC",
          "SCORING_BREAKER_TIMEOUT_SEC",
          "SCORING_HTTP_CONNECT_TIMEOUT",
          "SCORING_HTTP_READ_TIMEOUT",
          "SCORING_HTTP_WRITE_TIMEOUT",
          "SCORING_HTTP_POOL_TIMEOUT"
        ]
      },
      "structuralEquivalence": {
        "sameService": true,
        "sameEnvVarNames": true,
        "sameSecretNames": true,
        "sameArtifactInput": true,
        "sameRuntime": true,
        "status": "PENDING"
      }
    },
    {
      "serviceId": "supabase",
      "staging": {
        "replicasProposed": 1,
        "instanceSizeProposed": "provider-managed",
        "envVarNames": []
      },
      "prod": {
        "replicasProposed": 1,
        "instanceSizeProposed": "provider-managed",
        "envVarNames": []
      },
      "structuralEquivalence": {
        "sameService": true,
        "sameEnvVarNames": true,
        "sameSecretNames": true,
        "sameArtifactInput": true,
        "sameRuntime": true,
        "status": "PENDING"
      }
    },
    {
      "serviceId": "infisical-managed",
      "staging": {
        "replicasProposed": 1,
        "instanceSizeProposed": "provider-managed",
        "envVarNames": []
      },
      "prod": {
        "replicasProposed": 1,
        "instanceSizeProposed": "provider-managed",
        "envVarNames": []
      },
      "structuralEquivalence": {
        "sameService": true,
        "sameEnvVarNames": true,
        "sameSecretNames": true,
        "sameArtifactInput": true,
        "sameRuntime": true,
        "status": "PENDING"
      }
    },
    {
      "serviceId": "oci-e2-gateway",
      "staging": {
        "replicasProposed": 1,
        "instanceSizeProposed": "e2-micro",
        "envVarNames": []
      },
      "prod": {
        "replicasProposed": 1,
        "instanceSizeProposed": "e2-micro",
        "envVarNames": []
      },
      "structuralEquivalence": {
        "sameService": true,
        "sameEnvVarNames": true,
        "sameSecretNames": true,
        "sameArtifactInput": true,
        "sameRuntime": true,
        "status": "PENDING"
      }
    },
    {
      "serviceId": "vps-fallback",
      "staging": {
        "replicasProposed": 0,
        "instanceSizeProposed": "vps-small",
        "envVarNames": [
          "ANTHROPIC_API_KEY",
          "SARVAM_API_KEY",
          "COMPANY_NAME",
          "ANTHROPIC_MODEL",
          "SARVAM_STT_MODEL",